### ISSUE TITLE
errors messages on arch linux when running ./babeld-lab add

### ISSUE THREAD

**Issue by jhpoelen** [sudomesh/babeld-lab#1]
as shared by Arthur

Sorry, that second part was supposed to say 

(after calling  sudo ./babeld-lab.sh add)

calling 

sudo ./babeld-lab.sh up prints 

Cannot find device "veth-p0"
Cannot find device "veth-p1"
Cannot find device "veth-n0"
Cannot find device "veth-n1"
Cannot find device "br-babel"

On Wed, Mar 1, 2017 at 8:56 PM, Arthur xxx <xxx@xxxx> wrote:
So I got a linux (arch) vm up and running, installed wireshark, git, babeld, and bridge-tools (ip already installed).  Cloned babeld-lab, moved into that repository and called

sudo ./babeld-lab.sh add

as in step 1.

This is the error message I get:

vagrant@archlinux:~/babeld-lab$ sudo ./babeld-lab.sh add
RTNETLINK answers: Operation not supported
RTNETLINK answers: Operation not supported
add bridge failed: Package not installed
set stp status failed: No such device
interface veth-p0 does not exist!
interface veth-p1 does not exist!
Cannot create namespace file "/var/run/netns/n0": File exists
Cannot create namespace file "/var/run/netns/n1": File exists
Cannot find device "veth-n0"
Cannot find device "veth-n1"
Cannot find device "veth-n0"

For what it's worth, calling this again outputs

Cannot find device "veth-p0"
Cannot find device "veth-p1"
Cannot find device "veth-n0"
Cannot find device "veth-n1"
Cannot find device "br-babel"

I'll look through the file, but my bash is a bit rusty.

best,
Arthur

**Comment by jhpoelen** [comment]
I've had luck using babeld-lab on ubuntu with version

```
$uname -srv
Linux 4.4.0-64-generic #85-Ubuntu SMP Mon Feb 20 11:50:30 UTC 2017
```
what do you get when you run ```uname -srv```? Perhaps it is a linux version issue.

**Comment by paidforby** [comment]
on my arch machine
```
$uname -srv
Linux 4.8.13-1-ARCH #1 SMP PREEMPT Fri Dec 9 07:24:34 CET 2016
```

**Comment by paidforby** [comment]
Make sure ip and babeld are properly installed. If I remember correctly, I had to install ```ip``` while building my arch machine (or maybe that was ```iw```? either way...). Also, I wasn't able to pacman ```babeld``` and had to build it from their git repo (which requires ```make``` which I believe you can get using ```pacman -S base-devel```).
Also make sure to ```pacman -Syu```

**Comment by aetilley** [comment]
@jhpoelen , @gcgallo 

This is possibly an Arch problem (although Grant didn't seem to have a problem on his Arch).

https://bbs.archlinux.org/viewtopic.php?id=154331

I built a Debian-jessie vagrant box and 

sudo ./babeld-lab.sh add

executed without objection.

One small thing though:  In the comment in step 1 you say

"... and sudo ip netns exec n1 ip addr contains veth-n0."

Do you mean 

"...and sudo ip netns exec n1 ip addr contains veth-n1." ?

**Comment by aetilley** [comment]
@jhpoelen , @gcgallo 

Ah, I just installed iproute2 on the Arch vagrant box and now it works there too.  Win.

**Comment by jhpoelen** [comment]
@aetilley do you think we should update README.md to capture this?

**Comment by aetilley** [comment]
@jhpoelen, @gcgallo 

Actually I retract my comment about arch and iproute2.  I did a fresh install of an arch box and got the same problem.  Then *without* installing iproute2 I restarted the arch box and the problem went away.  Strange.  Anyway, I'd say that this is resolved.

**Comment by mhkabir123** [comment]
![capture](https://user-images.githubusercontent.com/29917877/34912145-b903d7be-f8d9-11e7-8cf8-5d74c0daa326.JPG)
Hi, I am facing problem when I am using "bash babeld-lab.sh -s" command: bellow error I found. Please help me.
root@kabir:~/babeld-lab# bash babeld-lab.sh -s
veth-n0: babeld process started
veth-n1: babeld process started
veth-n2: babeld process started
veth-n3: babeld process started
root@kabir:~/babeld-lab# exec of "babeld" failed: No such file or directory
exec of "babeld" failed: No such file or directory
exec of "babeld" failed: No such file or directory
exec of "babeld" failed: No such file or directory

**Comment by jhpoelen** [comment]
Did you install babeld? See https://github.com/sudomesh/babeld-lab#requirements .

**Comment by mhkabir123** [comment]
thanks for the reply. No, I didn't installed babeld separately. I only did git clone https://github.com/sudomesh/babeld-lab. Do I need install babeld (apt-get install babeld ) also?

**Comment by jhpoelen** [comment]
Yes, you need to install babeld . I've updated the README.md accordingly. Please feel free to submit pull requests if you find more inaccuracies or to suggest improvements.

**Comment by mhkabir123** [comment]
hi jhpoelen, my two interfaces are up, but couldn't ping from each other, even not pinging themselves. 
root@kabir:~/babeld-lab# ip netns exec n0 ip a
1: lo: <LOOPBACK> mtu 65536 qdisc noop state DOWN group default qlen 1
    link/loopback 00:00:00:00:00:00 brd 00:00:00:00:00:00
6: veth-n0@if7: <BROADCAST,MULTICAST,UP,LOWER_UP> mtu 1500 qdisc noqueue state UP group default qlen 1000
    link/ether 7e:21:47:0a:28:55 brd ff:ff:ff:ff:ff:ff link-netnsid 0
    inet 170.30.100.2/24 scope global veth-n0
       valid_lft forever preferred_lft forever
    inet6 fe80::7c21:47ff:fe0a:2855/64 scope link
       valid_lft forever preferred_lft forever
root@kabir:~/babeld-lab# ip netns exec n1 ip a
1: lo: <LOOPBACK> mtu 65536 qdisc noop state DOWN group default qlen 1
    link/loopback 00:00:00:00:00:00 brd 00:00:00:00:00:00
8: veth-n1@if9: <BROADCAST,MULTICAST,UP,LOWER_UP> mtu 1500 qdisc noqueue state UP group default qlen 1000
    link/ether fa:03:37:c7:5c:e2 brd ff:ff:ff:ff:ff:ff link-netnsid 0
    inet 170.30.101.2/24 scope global veth-n1
       valid_lft forever preferred_lft forever
    inet6 fe80::f803:37ff:fec7:5ce2/64 scope link
       valid_lft forever preferred_lft forever
root@kabir:~/babeld-lab# ip netns exec n0 ping 170.30.101.2
connect: Network is unreachable
root@kabir:~/babeld-lab# ip netns exec n1 ping 170.30.100.2
connect: Network is unreachable
root@kabir:~/babeld-lab# ip netns exec n0 ping 170.30.100.2
PING 170.30.100.2 (170.30.100.2) 56(84) bytes of data.
^C
--- 170.30.100.2 ping statistics ---
6 packets transmitted, 0 received, 100% packet loss, time 5042ms

#babeld are running on veth-n0 and veth-n1:
root@kabir:~/babeld-lab# bash babeld-lab.sh -s
veth-n0: babeld process started
veth-n1: babeld process started

#Log and process id files for started babel nodes created but ip route are not exactly like you.
root@kabir:~/babeld-lab# ls
babeld-lab.sh  babeld-n0.pid  babeld-n1.pid  diagram.png  LICENSE             README.md
babeld-n0.log  babeld-n1.log  diagram.dot    guides.md    operator_manual.md  services_guide.md
root@kabir:~/babeld-lab# sudo ip netns exec n0 ip route
170.30.100.0/24 dev veth-n0  proto kernel  scope link  src 170.30.100.2
root@kabir:~/babeld-lab# sudo ip netns exec n1 ip route
170.30.101.0/24 dev veth-n1  proto kernel  scope link  src 170.30.101.2
Please expecting your valuable suggestion. thanks

**Comment by mhkabir123** [comment]
Hi, Its resolved now! Thank you @jhpoelen .

root@kabir:~/babeld-lab/bridge-utils-1.6# tcpdump -i br-babel
tcpdump: verbose output suppressed, use -v or -vv for full protocol decode
listening on br-babel, link-type EN10MB (Ethernet), capture size 262144 bytes
01:00:31.991113 IP6 fe80::7c21:47ff:fe0a:2855.6696 > ff02::1:6.6696: babel 2 (8) hello
01:00:32.467540 IP6 fe80::2c16:aeff:fea6:fb57.dhcpv6-client > ff02::1:2.dhcpv6-server: dhcp6 inf-req
01:00:34.034382 IP6 fe80::f803:37ff:fec7:5ce2.6696 > ff02::1:6.6696: babel 2 (8) hello
01:00:35.506212 IP6 fe80::7c21:47ff:fe0a:2855.6696 > ff02::1:6.6696: babel 2 (60) hello ihu nh router-id update
01:00:38.356642 IP6 fe80::f803:37ff:fec7:5ce2.6696 > ff02::1:6.6696: babel 2 (60) hello ihu nh router-id update
01:00:40.651047 IP6 fe80::7c21:47ff:fe0a:2855.6696 > ff02::1:6.6696: babel 2 (8) hello
01:00:41.587257 IP6 fe80::f803:37ff:fec7:5ce2.6696 > ff02::1:6.6696: babel 2 (8) hello
01:00:44.195574 IP6 fe80::7c21:47ff:fe0a:2855.6696 > ff02::1:6.6696: babel 2 (8) hello
01:00:46.100310 IP6 fe80::f803:37ff:fec7:5ce2.6696 > ff02::1:6.6696: babel 2 (8) hello
01:00:48.209681 IP6 fe80::7c21:47ff:fe0a:2855.6696 > ff02::1:6.6696: babel 2 (24) hello ihu
01:00:50.273689 IP6 fe80::f803:37ff:fec7:5ce2.6696 > ff02::1:6.6696: babel 2 (24) hello ihu
01:00:51.812759 IP6 fe80::7c21:47ff:fe0a:2855.6696 > ff02::1:6.6696: babel 2 (8) hello

**Comment by jhpoelen** [comment]
Cool! What do you think should be changed to make babeld-lab a little easier to to use?

**Comment by mhkabir123** [comment]
hi, @jhpoelen 
I think you can add these two things in brctl section:
#add ports on brctl:
brctl addif br-babel veth-p0
brctl addif  br-babel veth-p1

Actually I have a plan to add one more interface port with each network namespace and attach them with physical interface, that I can use end devices. What you think?

**Comment by jhpoelen** [comment]
Sounds interesting! Please create pull request and suggest changes. . .

**Comment by mhkabir123** [comment]
@jhpoelen, Hi, can you please tell me, how can I configure and start babeld for network namespace? if I do not use your ready babeld-lab.sh. Actually I want to implement babeld for separate network namespace on two different hosts. thanks in advance.
